{
  "timestamp": "2025-07-31T16:04:27.623Z",
  "platform": "LibertyX Decentralized Content Platform",
  "version": "1.0.0",
  "phases": {
    "typescript": {
      "status": "failed",
      "score": 40
    },
    "eslint": {
      "status": "warning",
      "score": 70
    },
    "security": {
      "status": "warning",
      "score": 60
    },
    "testing": {
      "status": "failed",
      "score": 20
    },
    "performance": {
      "status": "passed",
      "score": 80
    },
    "accessibility": {
      "status": "warning",
      "score": 60
    },
    "documentation": {
      "status": "passed",
      "score": 60
    }
  },
  "overallScore": 56,
  "overallStatus": "failed",
  "productionReadiness": "NOT_READY",
  "errors": [
    {
      "phase": "CODE_QUALITY",
      "category": "TypeScript",
      "message": "TypeScript compilation errors found"
    },
    {
      "phase": "TESTING",
      "category": "Execution",
      "message": "Test suite execution failed"
    }
  ],
  "recommendations": [
    "Fix ESLint warnings and errors",
    "Update dependencies with security vulnerabilities",
    "Conduct comprehensive accessibility audit with axe-core",
    "Create docs/ documentation"
  ],
  "summary": "üìä LIBERTYX PLATFORM AUDIT SUMMARY\n\nüéØ Overall Results:\n   Score: 56/100\n   Status: FAILED\n   Production Readiness: NOT READY\n   Execution Time: 52.31s\n\nüìã Phase Results:\n   ‚ùå TYPESCRIPT: 40/100 (failed)\n   ‚ö†Ô∏è ESLINT: 70/100 (warning)\n   ‚ö†Ô∏è SECURITY: 60/100 (warning)\n   ‚ùå TESTING: 20/100 (failed)\n   ‚úÖ PERFORMANCE: 80/100 (passed)\n   ‚ö†Ô∏è ACCESSIBILITY: 60/100 (warning)\n   ‚úÖ DOCUMENTATION: 60/100 (passed)\n\n‚ùå Critical Issues (2):\n   ‚Ä¢ CODE_QUALITY: TypeScript compilation errors found\n   ‚Ä¢ TESTING: Test suite execution failed\n\nüí° Recommendations:\n   1. Fix ESLint warnings and errors\n   2. Update dependencies with security vulnerabilities\n   3. Conduct comprehensive accessibility audit with axe-core\n   4. Create docs/ documentation\n\nüöÄ Production Readiness Assessment:\n   üö´ CRITICAL: Platform is NOT READY for production deployment\n   ‚Ä¢ Address all critical issues immediately\n   ‚Ä¢ Ensure all tests pass and coverage is adequate\n   ‚Ä¢ Fix build and compilation errors"
}